A1: 上师大康城实验学校办公室环境卫生评比检查表
A2: 时间：2011年10月11日 | D2: 检查人： 曹晶 陆亚芳 沈叶萍
A3: 组室 | B3: 房间号 | C3: 检查标准及分值 | G3: 总分 | H3: 星级
C4: 环境卫生：地面无烟蒂、垃圾、污迹；窗台、桌面、办公设备无灰尘（30分） | D4: 桌面、书橱：资料堆放整齐，物品摆放有序（20分） | E4: 绿化：盆景植物枝叶无死枝、蔫黄（10分） | F4: 办公室布置：清洁、条理、新颖、独特、创新（40分）
A5: 一年级组 | B5: 5107 | C5: 29 | D5: 16 | E5: 9 | F5: 35 | G5: =F5+E5+D5+C5 -> 89 | H5: ★★★★
A6: 二年级组 | B6: 5207 | C6: 25 | D6: 15 | E6: 9 | F6: 32 | G6: =F6+E6+D6+C6 -> 81 | H6: ★★★★
A7: 三年级组 | B7: 5307 | C7: 22 | D7: 12 | E7: 6 | F7: 30 | G7: =F7+E7+D7+C7 -> 70 | H7: ★★★
A8: 四年级组 | B8: 5407 | C8: 26 | D8: 16 | E8: 8 | F8: 38 | G8: =F8+E8+D8+C8 -> 88 | H8: ★★★★
A9: 五年级组 | B9: 8121 | C9: 29 | D9: 18 | E9: 10 | F9: 36 | G9: =F9+E9+D9+C9 -> 93 | H9: ★★★★★
A10: 六年级组 | B10: 8222 | C10: 21 | D10: 11 | E10: 8 | F10: 30 | G10: =F10+E10+D10+C10 -> 70 | H10: ★★★
B11: 8223 | C11: 23 | D11: 17 | E11: 6 | F11: 32 | G11: =F11+E11+D11+C11 -> 78
A12: 七年级组 | B12: 8301 | C12: 20 | D12: 10 | E12: 7 | F12: 33 | G12: =F12+E12+D12+C12 -> 70 | H12: ★★★
B13: 8302 | C13: 23 | D13: 16 | E13: 7 | F13: 33 | G13: =F13+E13+D13+C13 -> 79
A14: 八年级组 | B14: 8303 | C14: 20 | D14: 9 | E14: 5 | F14: 30 | G14: =F14+E14+D14+C14 -> 64
B15: 8403 | C15: 22 | D15: 10 | E15: 5 | F15: 32 | G15: =F15+E15+D15+C15 -> 69
A16: 九年级组 | B16: 8410 | C16: 27 | D16: 15 | E16: 10 | F16: 36 | G16: =F16+E16+D16+C16 -> 88 | H16: ★★★★
A17: 体育组 | B17: 5111 | C17: 25 | D17: 15 | E17: 5 | F17: 30 | G17: =F17+E17+D17+C17 -> 75 | H17: ★★★
A18: 音美组 | B18: 5212 | C18: 22 | D18: 5 | E18: 9 | F18: 26 | G18: =F18+E18+D18+C18 -> 62
A19: 发现问题：桌面物品摆放凌乱，电源、风扇开关上面灰尘较多，垃圾没有及时清理。大多数办公室无公约和值日表。
A20: 整改措施：通知各工会小组长针对问题及时改进，平时加强督促检查。